<?xml version="1.0" encoding="UTF-8"?>
<timedautomata xmlns:xsi="http://www.w3.org/2001/XMLSchema-instance"
               xsi:noNamespaceSchemaLocation="http://www.labri.fr/~fmoranda/xsd/tima.xsd"
               name="ex1">

    <state name="s0" action="s0" initial="true">
        <path to="s1" timeout="10" guard="t1"/>
        <path to="s2" timeout="15" guard="t2"/>
        <timeout to="timeout"/>
    </state>
    <state name="s2" action="s2">
        <path to="s3" timeout="10" guard="t3"/>
        <timeout to="timeout"/>
    </state>
    <state name="s1" action="s1">
        <path to="s2" timeout="12" guard="t4"/>
        <timeout to="timeout"/>
    </state>
    <state name="s3" action="s3">
        <path to="s1" timeout="5" guard="t5"/>
        <timeout to="timeout"/>
    </state>
    <state name="timeout" action="timeout"/>
</timedautomata>